Question,Answer,Keyword
Describe the core 'Physical Infrastructure' requirements for a MyData business license.,"Must possess computing facilities like network-separated systems, security equipment, and backup facilities for safe data processing.","MyData Infrastructure, Licensing"
Explain how 'Differential Privacy' used in the financial sector balances data analysis and security.,"By adding noise to datasets, it prevents individual record exposure while maintaining the statistical characteristics of the whole.","Differential Privacy, FinTech"
Describe the technical background for why Post-Quantum Cryptography (PQC) must replace existing public-key cryptosystems.,"Quantum computers running Shor's algorithm can quickly solve the mathematical problems underlying RSA and ECC, neutralizing them.","PQC, Quantum Threat"
Explain the risks of 'Prompt Injection' in financial generative AI and suggest countermeasures.,Malicious inputs forcing AI to bypass guidelines or leak sensitive data; countermeasures include strict input filtering and sandboxing.,"Prompt Injection, AI Security"
Describe the role and benefits of a Cloud Access Security Broker (CASB).,It acts as a gateway between cloud services and users to enforce security policies and provide data visibility and encryption.,"CASB, Cloud Security"
Explain the 'OAuth 2.0' authorization process for securing financial Open API platforms.,Users grant third-party apps limited access via tokens without sharing their actual passwords.,"OAuth 2.0, API Security"
Suggest technical countermeasures for 'Deepfake' bypass attacks in remote identity verification.,Combining AI-based liveness detection with requests for random user actions during video calls.,"Deepfake, Liveness Detection"
Explain the importance of 'Image Vulnerability Scanning' for containers in a CI/CD pipeline.,Detecting malware or vulnerable libraries in images before deployment to prevent compromised containers from running in production.,"Container Security, CI/CD"
Describe the benefit to personal data subjects of applying 'Blockchain DID' to financial services.,"Individuals directly manage their identity information and selectively submit only the minimum required data, enhancing privacy.","Blockchain DID, Self-sovereign Identity"
How does 'Explainable AI (XAI)' impact regulatory compliance and trust in financial services?,"By explaining the reasoning behind AI decisions, it proves the fairness and transparency of processes like credit scoring.","XAI, Trustworthy AI"
